title,link,start_date,end_date,hours,ages,Indoor/Outdoor,Category,website,location,phone,description,cost
Weaving an Address,https://www.bostoncentral.com/events/artsculture/p82312.php,04/14/2025,06/14/2025,All Day,"Kids, Teens, Adults","Indoor, Outdoor",Arts & Culture,https://www.bostoncentral.com/fwd.php?pgx=tavinrJ%2Fteb.fgeNnyyreozHruG%2F%2F%3Afcggu,40 STOW ST. CONCORD MA,978,"The Umbrella Arts Center in historic Concord Center will commemorate the semiquincentennial of the American Revolution and “the shot heard round the world” with an ambitious outdoor/indoor public and gallery art exhibition, Weaving an Address, curated by artist Marla McLeod. For the first time, Weaving an Address combines The Umbrella’s popular Art Ramble public art installation, on view April 15 through October 7 at Brister’s Hill in nearby Walden Woods, with an indoor exhibition on view April 14 through June 14 in The Umbrella’s Allie Kussin Gallery. The exhibition features site-specific work by eight prominent Black artists combining sculpture, fiber art, installation and live performance inspired by little-known experiences of historical Black inhabitants of Concord and its Walden Woods. Featured artists in the exhibition are Ifé Franklin, Stephen Hamilton, Whitney Harris, Ekua Holmes, Perla Mabel, Marla McLeod, Kimberly Love Radcliffe, and Anthony Peyton Young. Outdoors, large-scale work will be installed on Brister’s Hill, named for Brister Freeman, an enslaved man who won his freedom by serving in the Revolutionary War and then bought the property and lived there along with other formerly enslaved. Indoors at The Umbrella, inter-related fiber artworks will weave narratives from fragmented pasts to offer a vision of how history shapes the present and influences the future. Supporting community activities include an opening reception on April 14, monthly curator talks, a processional with artist Ifé Franklin, and participation in the town-wide Revolutionary Concordians Trading Card program. This exhibition is presented as part of the Concord250 commemoration, in partnership with The Walden Woods Project and The Robbins House, in association with Gather 2025, a month-long exploration and celebration of fiber and textile art in Greater Boston, and with permission of Concord Natural Resources Division. See https://TheUmbrellaArts.org/Weaving for more information about special engagements, wayfinding, artist bios, and background to the exhibition. ACCESS: The Umbrella is wheelchair accessible, with ADA parking and marked all-gender bathrooms available. There is assessed parking for visitors to the Brister's Hill site on Walden Street, just north of the intersection with Route 2. More details on our website.",Free
Bonsai Workshop at Old Planters Brewery,https://www.bostoncentral.com/events/special/p81621.php,04/15/2025,05/20/2025,7:00 pm to 9:00 pm Timezone: EDT,Adults,Indoor,Special Events,https://www.bostoncentral.com/fwd.php?pgx=lerjreo-ferganyc-qyb%2Ffgphqbec%2Fzbp.enovnfabo%2F%2F%3Afcggu,OLD PLANTERS BREWERY  232 RANTOUL ST BEVERLY MA,401,"Beginner workshops are perfect for you to grab your friends, grab a drink and come make tiny trees! We’re bringing the awesome art of bonsai out of the hedged in gardens and into the streets! Or at least into your favorite bars/breweries/pubs. Bonsai Bar is a night of fun you don’t want to miss. Learn the fundamental skills and techniques behind the art of bonsai while enjoying a night out with friends! Our teachers will introduce core concepts and guide your experience as you pot, prune, and design your very own bonsai tree! Our Guarantee: These tiny trees are so hardy we guarantee you can keep yours alive, or we’ll replace it. This workshop will be hosted at Old Planters Brewery. Our goal has always been to be firmly rooted in our community with everything we do. Whether it’s collaborating with other local businesses in our area (FRANK / Crave / Wandering Soul/ Fat Tuna Charters/ Half Baked) or giving back to the place that has given us so much (Beverly Hospital/HarborLight community partners) . This idea of community rings true in our taproom as well. Our space has become a meeting place to hear local musicians, enjoy local artists, and get a taste of various foods in the Beverly area . It’s also a space where we would like ALL members of our community to feel welcome and accepted. For many, craft breweries can sometimes feel exclusive and intimidating for those that don’t consider themselves “beer nerds” and this is a notion we will always work hard to dispel. We believe beer should be fun/accepting and our goal is to always have a variety of beers that speak to a wide audience. Under 21 policy: Please contact Old Planters Brewery for details regarding underage entry For more about Bonsai Bar and what to expect at our classes, visit our website .",$85.00
Happy Birthday Leonardo da Vinci! at Discovery Museum,https://www.bostoncentral.com/events/artsculture/p81999.php,04/15/2025,04/17/2025,Hours Varysee below,"Toddlers, Kids, Teens, Adults",Indoor,Arts & Culture,https://www.bostoncentral.com/fwd.php?pgx=1-vpavi-nq-bqenabry-lnqugevo-lccnu%2Ffznetbec-fgarir%2Fteb.abgpnleribpfvq.jjj%2F%2F%3Afcggu,"DISCOVERY MUSEUM, 177 MAIN STREET (ROUTE 27) ACTON MA",9782644200,"Tuesday, April 15 through Thursday, April 17 | 9:00am – 4:00pm Join Discovery Museum as we celebrate Leonardo da Vinci’s birthday. Born on April 15, 1452, Leonardo da Vinci was an inventor, artist, engineer, and mathematician who spent his lifetime following his curiosity and exploring a wide variety of interests. Be inspired by da Vinci’s passion for flight as you build paper helicopters at our Wind Table, try a bridge building challenge in da Vinci Workshop, go on a scavenger hunt to discover some of da Vinci’s most visionary inventions, and practice your hand at writing backwards like da Vinci. HOURS ↑ top Tuesday, April 15 through Thursday, April 17 | 9:00 am – 4:00 pm",Free
Keeping It Moving to a Better You (with Mitzi Carrasquillo and Leslie Guity),https://www.bostoncentral.com/events/learn/p82303.php,04/15/2025,04/15/2025,4:00 pm - 5:30 pm,"Kids, Teens",Indoor,Learn Something,https://www.bostoncentral.com/fwd.php?pgx=59467n0003782s3554p6pq76%2Ffgarir%2Fzbp.fabzzbpbvyovo.yco%2F%2F%3Afcggu,"CODMAN SQUARE, 690 WASHINTON ST. DORCHESTER MA",N/A,"In observance of Sexual Assault Awareness Month in April, please join us for an educational workshop geared towards middle and high school girls (grades 6-12). Presenters author Mitzi Carrasquillo and author Leslie Guity will be covering the following topics: sexual assault awareness, self esteem, self confidence, and loving yourself. Each attendee will receive a gift from the presenters. Registration is required for this workshop. Please RSVP to either Mitzi Carrasquillo at 301.536.3662, mitzicarrasquillo@gmail.com OR Leslie Guity at 617.605.3097, orangestic1@yahoo.com. Thank you! For more information on Sexual Assault Awareness Month, please visit https://www.nsvrc.org/saam . Suitable for: Teens (Ages 13-18) | Tweens (Ages 9-12) WEBSITE ↑ top bpl.bibliocommons.com/events/67dc6c4553f2873000a76495 LOCATION ↑ top Codman Square, 690 Washinton St., Dorchester, MA, 02124 map RELATED LINKS ↑ top Profiles Learn Something Events Keeping It Moving to a Better You , 4/15/25-4/15/25 Info changes frequently. We cannot warrant it.  Verify with Keeping It Moving to a Better You (with Mitzi Carrasquillo and Leslie Guity) before making the trek. If you find an error, please report it... Report Error Popular Resources Boston with Kids Free Things to Do Family & Kids Events Mass RMV - DMV Boston Birthday Parties Boston Museums Rose Kennedy Greenway Boston Aquarium Boston Massachusetts Boston Bowling Boston Haymarket Boston Whale Watching",Free
The Boston Globe Sustainability Summit,https://www.bostoncentral.com/events/green/p82405.php,04/15/2025,04/15/2025,10:00 am - 3:00 pm,Adults,Indoor,Green Events,https://www.bostoncentral.com/fwd.php?pgx=%2Fzbp.gnugufnycf.gvzzhflgvyvonavngfhfrobyt%2F%2F%3Afcggu,665 COMMONWEALTH AVE. BOSTON MA,N/A,"Join us at The Boston Globe's 2025 Sustainability Summit, where visionaries, policymakers, and changemakers shaping the future of our planet will come together. Through dynamic discussions and expert-led panels, we will explore the innovative solutions that are transforming industries and paving the way for a more eco-conscious world. The summit's programming will dive into a variety of timely sustainability topics — from revolutionizing homes and eliminating plastics to empowering the next generation of environmental leaders. Be part of the conversation that sparks bold action and drives the change needed to secure a sustainable future for all. Space is limited, register today!",$100
Fingerprint Detectives,https://www.bostoncentral.com/events/learn/p81883.php,04/16/2025,04/16/2025,Drop in between 2:00pm - 4:00pm,"Toddlers, Kids",Indoor,Learn Something,https://www.bostoncentral.com/fwd.php?pgx=1-frivgprgrq-gavecertavs%2Ffznetbec-fgarir%2Fteb.abgpnleribpfvq.jjj%2F%2F%3Afcggu,DISCOVERY MUSEUM ACTON MA,978,"Take a closer look at the intricate patterns of your own unique fingerprints. Use tools to make observations and compare your fingerprints to others’. Do you have arches, whorls, loops, or a mix?",see below
Wenham Wednesdays – Craft,https://www.bostoncentral.com/events/art/p82174.php,04/16/2025,04/16/2025,1:15 pm to 4:00 pm,Kids,Indoor,Arts & Crafts,https://www.bostoncentral.com/fwd.php?pgx=%2Ffznetbec-ssb-cbeq%2Fteb.zhrfhzznuarj.jjj%2F%2F%3Afcggu,132 MAIN STREET WENHAM MA,9784682377,"Early release drop-off program for Hamilton-Wenham elementary students. Sign up for one Wednesday, or every Wednesday! Seasonal Craft – Earth Day Craft Enjoy an afternoon at the museum with friends Bring a snack Create a seasonal craft Explore the museum galleries until it is time to go home NEW: Early release drop-off program for Hamilton-Wenham elementary students Every Wednesday during the school year, Wenham Wednesdays will feature activities such as craft projects, board games, LEGO building, paper crafts, and more – plus time for students to explore the museum galleries with friends. Sign up for one Wednesday, or every Wednesday! Learn more here!",$35
Lanterns & Luminaries Kicks Off Patriots’ Day Weekend,https://www.bostoncentral.com/events/special/p81351.php,04/16/2025,04/16/2025,11:00 a.m. to 12:15 p.m.,"Infants, Toddlers, Kids, Teens, Adults",Indoor,Special Events,https://www.bostoncentral.com/fwd.php?pgx=ug052%2Fzbp.ugebaqyb.jjj,193 SALEM STREET BOSTON MA,N/A,"BOSTON – To commemorate the 250th anniversary of the iconic “two if by sea” lantern signals that heralded the American Revolution, Old North Illuminated will kick off Patriots’ Day weekend with a special event, Lanterns and Luminaries. Set for Wednesday, April 16 at Old North Church & Historic Site, the annual event will honor award-winning filmmaker Ken Burns with the prestigious Third Lantern Award. This recognition celebrates individuals who exemplify the values symbolized by Old North Church’s legendary lanterns—leadership, courage, hope, tenacity, and active citizenship. The award ceremony precedes a preview event for Burns’s eagerly awaited film, The American Revolution, that evening in Boston. The event will feature a seated program from 11 a.m. to 12:15 p.m. including a dramatic reading of “Paul Revere’s Ride” in celebration of the anniversary, along with inspiring remarks from Burns, a short clip from his new documentary, festive music, and a look ahead at the Patriots’ Day festivities in the North End. Tickets to the program are available for purchase in advance for $40. For more details and to register, visit www.oldnorth.com/250th . Looking for more Patriots Day events and things to do ?  Peruse our handy guide for lots more ideas and insider tips to enjoying this unique Massachusetts holiday. Find more 250th Anniversary of the American Revolution Events taking place in Massachusetts in our handy guide.",$40.00
LGBTQIA+ Singer-Songwriter Concert,https://www.bostoncentral.com/events/music/p81859.php,04/16/2025,04/16/2025,7:00 pm onwards,"Kids, Teens, Adults",Indoor,Music & Concerts,https://www.bostoncentral.com/fwd.php?pgx=gerpabp-ergvejtabf-ertavf-nvdgoty%2Ffgarir%2F939-rsnp-zbbe-qre%2Fhqr.rryxero.jjj%2F%2F%3Afcggu,939 BOYLSTON ST BOSTON MA,617,"Sexuality and Gender Alliance (SAGA) and Berklee Theater Arts Collaborative (BTAC) co-sponsor the LGBTQIA+ Singer-Songwriter Concert, followed by a LGBTQIA+ social afterwards in the William Davis room in the 150 Mass Ave building. Come experience the joy on April 16 @7 pm at The Red Room! Free entry. Don't miss out on this!",Free
Wenham Wednesday - Craft,https://www.bostoncentral.com/events/art/p82047.php,04/16/2025,04/16/2025,1:15 pm - 4:00 pm,Kids,Indoor,Arts & Crafts,https://www.bostoncentral.com/fwd.php?pgx=%2F42-flnqfraqrj-znuarj%2Fgarir%2Fteb.zhrfhzznuarj.jjj%2F%2F%3Afcggu,"WENHAM MUSEUM, 132 MAIN STREET WENHAM MA",N/A,"Early release drop-off program for Hamilton-Wenham elementary students. Sign up for one Wednesday, or every Wednesday! Seasonal Craft – Earth Day Craft • Enjoy an afternoon at the museum with friends • Bring a snack • Create a seasonal craft • Explore the museum galleries until it is time to go home NEW: Early release drop-off program for Hamilton-Wenham elementary students Every Wednesday during the school year, Wenham Wednesdays will feature activities such as craft projects, board games, LEGO building, paper crafts, and more – plus time for students to explore the museum galleries with friends. Sign up for one Wednesday, or every Wednesday!",$$see below
ART & CHAMPAGNE at Davio's Lynnfield,https://www.bostoncentral.com/events/food/p82147.php,04/16/2025,04/16/2025,4:00 pm - 6:00 pm,Adults,Indoor,Food Fun,https://www.bostoncentral.com/fwd.php?pgx=ratncznup-gen%2Ffgarir%2Fqyrvsaaly%2Fzbp.fbvinq%2F%2F%3Afcggu,1250 MARKET ST LYNNFIELD MA,N/A,"ART & CHAMPAGNE at Davio's Lynnfield Immerse yourself in an evening of art, elegance, and exquisite flavors at Davio’s Lynnfield. Wednesday, April 16, 2025 4:00 PM – 6:30 PM $85 per person (Check HERE for tickets!) Join Fashion Illustrator & Visual Artist Annie Naranian for an exclusive hands-on workshop where you'll master your drawing and painting skills while enjoying: Champagne tasting provided by Veuve Clicquot and Chef-selected appetizers, including: - Charcuterie Cups — Marinated Vegetables, Mixed Olives, Cured Italian Meats, Imported Cheeses - Passed Appetizers - Parmigiano Fries, Truffle Aioli - Tomato, Mozzarella Skewer - Spice Rubbed Tuna, Pickled Relish, Wonton Wasabi Chip, Aioli - Davio’s Philly Cheese Steak Spring Rolls® with Spicy Ketchup & Spicy Mayo - Chicken Parm Spring Rolls® with Marinara - Buffalo Chicken Spring Rolls® with Blue Cheese",$85
Facilitation Lab Boston: Hands-On Practice with Jake Knapp & Voltage Control,https://www.bostoncentral.com/events/learn/p82213.php,04/16/2025,04/16/2025,06:00 PM - 08:00 PM,Adults,Indoor,Learn Something,https://www.bostoncentral.com/fwd.php?pgx=%2Fabgfbo%2Fony-abvgngvyvpns%2Fchgrrz%2Ffgarir%2Fzbp.ybegabprtngybi%2F%2F%3Afcggu,129 SOUTH ST BOSTON MA,5127669125,"Join us for an interactive session at Facilitation Lab Boston! This month, we’ll explore Click by Jake Knapp, practicing the “Differentiators” exercise from the Foundation Sprint—a powerful method to help teams define what sets their projects apart. Facilitators Ashley Morgan and Danielle Kayal will guide us through real-time role-play and hands-on exercises, using our tried-and-tested Practice Playground format. Whether you’re an experienced facilitator or just getting started, this is your chance to experiment, refine your skills, and get constructive peer feedback in a supportive environment. As a special bonus, we’re giving away two copies of Click! Reserve your spot today and take your facilitation skills to the next level. WEBSITE ↑ top voltagecontrol.com/events/meetup/facilitation-lab/boston/ LOCATION ↑ top 129 South St, Boston, MA, 02111 map Phone: 5127669125 RELATED LINKS ↑ top Profiles Learn Something Localities Boston Events Facilitation Lab Boston: Hands-On Practice with Ja... , 4/16/25-4/16/25 Info changes frequently. We cannot warrant it.  Verify with Facilitation Lab Boston: Hands-On Practice with Jake Knapp & Voltage Control before making the trek. If you find an error, please report it... Report Error Popular Resources Boston with Kids Free Things to Do Family & Kids Events Mass RMV - DMV Boston Birthday Parties Boston Museums Rose Kennedy Greenway Boston Aquarium Boston Massachusetts Boston Bowling Boston Haymarket Boston Whale Watching",Free
Easter Jumperoo,https://www.bostoncentral.com/events/special/p82383.php,04/16/2025,04/16/2025,10:00 am - 12:00 pm,"Infants, Toddlers, Kids, Adults",Indoor,Special Events,https://www.bostoncentral.com/fwd.php?pgx=%2FnTlhl5OU61%2Frenuf%2Fzbp.xbborpns.jjj%2F%2F%3Afcggu,"URBAN AIR ADVENTURE PARK, 189 MECHANIC STREET BELLINGHAM MA",N/A,"🐰You and your little bunnies don't want to miss our special Easter Jumperoo!! Perfect for kiddos 5 and under with their parents so they can hunt eggs and jump with other kids their age! Come on in for the egg hunt and meet Urbie Bunny!! This Wednesday, March 27th 10am - noon $11.99 per person (parents are free)",$11.99 per person (parents are free)
Urbie's Easter Egg Hunt,https://www.bostoncentral.com/events/special/p82385.php,04/16/2025,04/16/2025,4:00 pm - 8:00 pm,"Toddlers, Kids, Teens, Adults",Indoor,Special Events,https://www.bostoncentral.com/fwd.php?pgx=%2F7414723854210461%2Ffgarir%2Fzbp.xbborpns.jjj%2F%2F%3Afcggu,"URBAN AIR ADVENTURE PARK, 189 MECHANIC STREET BELLINGHAM MA",N/A,"🐰 Our Mega Easter Egg Hunt is back! 🐣 Doors Open at 4:00pm 🐰 Arrive Early to participate in the Easter Egg Hunt! Mega Easter Egg Hunt tickets are a flat $26 and includes your Ultimate Attractions Pass! 🐣 Hunt for over 5000 colorful Easter Eggs! It's going to be a fun and festive time for all! Eggs will contain candy, prizes and tickets for free ICEEs! ALSO 🏆Find one of 3 GOLDEN EGGS!!!🏆 2 with a $100 gift card 1 with an Ultimate Party for 10! ****** Mega Hunt details: *Tickets are $26 for all ages/all jumpers *Memberships accepted for this event *Socks not included *Parent pass price (for parents that want to jump) is $26 for this event. We can't wait for another fun event!",$26 for all ages/all jumpers
Patriots Day in Lexington,https://www.bostoncentral.com/events/patriots-day-lexington-events/p72413.php,04/17/2025,04/22/2025,9:00 AM - 4:00 PM,"Infants, Toddlers, Kids, Teens, Adults","Indoor, Outdoor",Seasonal Fun,https://www.bostoncentral.com/fwd.php?pgx=abgtavkrY-av-lnQ-fgbvegnC%2F158%2Fibt.nzabgtavkry.jjj%2F%2F%3Afcggu,LEXINGTON COMMON LEXINGTON MA,N/A,"2025 marks 250 years since the Battle of Lexington and the start of the American Revolution. The traditional Patriots' Day events will still take place, including the sunrise reenactment on the historic Lexington Battle Green, the annual 5-mile run, and the afternoon parade; however, all of these events will occur on Saturday, April 19th, 2025. It's time to put on your tricorn hat, to practice playing the fife, to revisit your history.  Patriots’ Day weekend commemorates the opening battles of the American Revolutionary War. April 17 9:00 a.m. | Lexington Kick Off Press Conference 12:00 p.m. | Ken Burns, The American Revolution 7:00 p.m. | Patriots’ Day Awards Ceremony April 18 10:00 p.m. | Reenactment of Paul Revere’s Midnight Ride April 19 5:15 a.m. | Reenactment of the Battle of Lexington 5:30 a.m. | Pancake Breakfasts 8:00 a.m. | 111th Patriots’ Day 5-Mile Road Race 9:00 a.m. | USS Lexington Ceremony 10:00 a.m. | Daughters of the American Revolution Tree Dedication 11:00 a.m. | Battle Green Rededication 2:00 p.m. | Patriots’ Day Parade 7:00 p.m. | Lexington Bicentennial Band Concert April 21 9:30 a.m. | Ye Ole Burial Ground Ceremony 10:00 a.m. | Revolutionary Scavenger Hunt 2025 10:00 a.m. | Daughters of the American Revolution Wreath Laying Ceremony 11:00 a.m. | Patriots’ Day Living History at Buckman Tavern 12:30 p.m. | Arrival of Paul Revere & William Dawes on Horseback from Boston April 22 11:00 a.m. | Naturalization Ceremony It is a joyful celebration, a street theater experience, and you get the glimmerings of what it must have been like on that chilly April morning as the Red Coats advanced on the Common. There are battles, concerts, tours, Paul Revere, reenactments, road races, pancake breakfasts, ceremonies, culminating in the BIG PARADE. For more information, visit patriotsday.com Looking for more Patriot's Day Events nearby?  Visit our website for lots more and use the search term 'Patriot's Day'; or visit our handy guide to Boston Patriots Day Events . WEBSITE ↑ top www.lexingtonma.gov/851/Patriots-Day-in-Lexington LOCATION ↑ top Lexington Common, Lexington, MA, 02420 map Lexington Center, Lexington, MA 02420 TIPS ↑ top Looking for more fun things to do?  Check out our Boston April Vacation Week guide for lots more great ideas on things to do with the kids this week. RELATED LINKS ↑ top Profiles Seasonal Fun School Vacation Localities Lexington Events Patriots Day in Lexington , 4/17/25-4/22/25 Info changes frequently. We cannot warrant it.  Verify with Patriots Day in Lexington before making the trek. If you find an error, please report it... Report Error Popular Resources Boston with Kids Free Things to Do Family & Kids Events Mass RMV - DMV Boston Birthday Parties Boston Museums Rose Kennedy Greenway Boston Aquarium Boston Massachusetts Boston Bowling Boston Haymarket Boston Whale Watching",Free
Memorial Drive Recreation Sundays 2025,https://www.bostoncentral.com/events/races/p69768.php,04/17/2025,11/09/2025,11:00am - 7:00pm,"Infants, Toddlers, Kids, Teens, Adults",Outdoor,Races/Walks,https://www.bostoncentral.com/fwd.php?pgx=riveQynvebzrZ%2FabvgngebcfaneGqaNfgrregF%2Fibt.nzrtqveoznp.jjj%2F%2F%3Afcggu,RIVERBEND PARK MEMORIAL DRIVE CAMBRIDGE MA,N/A,"Bring your bike, inline skates, running shoes, strollers or walking feet to take advantage of the unique access to this normally busy road with views of the Charles. Fun for all ages, families & visitors. On April 3, 2023, the Department of Conservation and Recreation announced that Riverbend Park will open on Sundays from 11:00am - 7:00pm from Sunday, April 27 to Sunday, November 9, 2025. This means that the portion of Memorial Drive between Western Avenue and Gerry's Landing Road will close to cars so that pedestrians, cyclists and others can enjoy the riverfront roadway without cars. Traffic patterns will be clearly marked. Memorial Drive is operated and controlled by DCR . WEBSITE ↑ top www.cambridgema.gov/StreetsAndTransportation/MemorialDrive LOCATION ↑ top Riverbend Park Memorial Drive, Cambridge, MA, 02138 map RELATED LINKS ↑ top Profiles Races/Walks Localities Cambridge Events Memorial Drive Recreation Sundays 2025 , 4/17/25-11/9/25 Info changes frequently. We cannot warrant it.  Verify with Memorial Drive Recreation Sundays 2025 before making the trek. If you find an error, please report it... Report Error Popular Resources Boston with Kids Free Things to Do Family & Kids Events Mass RMV - DMV Boston Birthday Parties Boston Museums Rose Kennedy Greenway Boston Aquarium Boston Massachusetts Boston Bowling Boston Haymarket Boston Whale Watching",Free
Night in Bloom at Boston Public Market,https://www.bostoncentral.com/events/adult/p81824.php,04/17/2025,04/17/2025,7:00 PM - 10:00 PM,Adults,Indoor,Adults (21+),https://www.bostoncentral.com/fwd.php?pgx=ryvsbectebcbfqor%3Dssn%3F9918498482621-fgrxpvg-grxenz-pvyohc-abgfbo-gn-zbbyo-av-gutva%2Fr%2Fzbp.rgveogarir.jjj%2F%2F%3Afcggu,100 HANOVER ST BOSTON MA,N/A,"Night in Bloom at Boston Public Market Join us for our second seasonal, 21+ night market as we celebrate spring in style at the Boston Public Market! 🌼 Spring Decor Enjoy the bright, springy atmosphere as you stroll through the Market 🎶 Music Groove the winter blues away to music from a local DJ 🍹 Seasonal Sips Your ticket includes one cocktail, beer, or wine from The Pine Bar or a hard cider from Red Apple Farm’s Hard Cider Bar. Cash bar available 🍴 Food Specials Satisfy your cravings with late-night specials available for purchase from our local food vendors 🛍️ Late Night Shopping Explore unique local products, handmade gifts, and art! Additionally, your ticket includes a $5 voucher to redeem next time you visit us (limit first 200 attendees) 🌈 Get Creative Sit down and make something special with your own hands with help from our artisanal vendors Unwind after work, connect with friends and family, or bring a date! Grab your ticket for just $20 and join us for an after hours 21+ party at the Boston Public Market. Secure your spot today and let’s spring forward together!",$23.18
