title,link,start_date,end_date,hours,ages,Indoor/Outdoor,Category,website,location,phone,description,cost
Painting with Watercolor and Oil Pastels,https://www.bostoncentral.com/events/art/p82132.php,04/28/2025,06/16/2025,5:45 pm - 7:15 pm,"Kids, Teens, Adults",Indoor,Arts & Crafts,https://www.bostoncentral.com/fwd.php?pgx=5202-yvecn-fyrgfnc-yvb-qan-ebybpergnj-ugvj-tavgavnc%2Ffrtnc%2Fzbp.qanylnjfgen%2F%2F%3Afcggu,225 BOSTON POST RD WAYLAND MA,6175138232,"Develop or refine your skill in painting with watercolor and oil pastels with Dr. Rahul Ray. The 8-week class will begin on Monday April 28th, from 5:45 to 7:15, at The First Parish in Wayland. The classes will be held in a studio setting and focus on fundamental skills, such as observation, perspective, scale, and technique (e.g. sketching). Various subjects, including still-life, landscape, and portrait will be included in the exercises. Oil pastels will provide a versatile medium for painting with bright colors. On the other hand, success with watercolor considered a difficult medium, will be all but guaranteed. This is what a past student had to say –“ I took an 8-week watercolor class with Ray Rahul in the spring of 2023. We painted a different still life arrangement each week. My goals (as a beginner) for the class were simple. I wanted to learn basic watercolor techniques and practice what I was learning with the guidance of a teacher. I also wanted to learn how to really see the subjects and to try to develop my own style. My goals were met and expectations exceeded. Ray taught us many basic techniques and helped us learn how to see objects in terms of perspective, relative placement, shapes, shadows, values, etc. I learned so much in his class and very much enjoyed the process.” Sign up: www.artswayland.com",$400
Berklee Original Open Mic,https://www.bostoncentral.com/events/music/p82347.php,04/28/2025,04/28/2025,7:00 pm,"Kids, Teens, Adults",Indoor,Music & Concerts,https://www.bostoncentral.com/fwd.php?pgx=5202-pvz-arcb-ynavtveb-rryxero-zbbo%2Ffgarir%2F939-rsnp-zbbe-qre%2Fhqr.rryxero.jjj%2F%2F%3Afcggu,939 BOYLSTON ST BOSTON MA,617,"In conjunction with the Red Room at Cafe 939, the Songwriting Department proudly presents BOOM (Berklee Original Open Mic), an open mic event for Berklee songwriters. All current Berklee students are welcome to play one original song in less than five minutes. Sign up at the Red Room at Cafe 939 beginning at 6:00 p.m.",Free
Backyard and Beyond: Working in the Garden,https://www.bostoncentral.com/events/nature/p61050.php,04/29/2025,04/29/2025,10:30am to 12pm - Drop in,"Toddlers, Kids",Outdoor,Nature & Outdoors,https://www.bostoncentral.com/fwd.php?pgx=31-arqent-tavxebj-qablro-qan-qenlxpno%2Ffznetbec-fgarir%2Fteb.abgpnleribpfvq.jjj%2F%2F%3Afcggu,DISCOVERY MUSEUM ACTON MA,978,"Learn what plants need to grow and help us take care of the Discovery Woods Garden. In early spring we need to get our garden ready for the new season! Come help us trim back last year’s plants, weed, mulch, compost and prepare our garden beds for the growing season. Inclement weather may result in changes to this program, or cancellation.",$see below
Mean Girls,https://www.bostoncentral.com/events/theater/p80522.php,04/29/2025,05/04/2025,Hours Varysee below,"Teens, Adults",Indoor,Theater & Shows,https://www.bostoncentral.com/fwd.php?pgx=%2Ffyevt-anrz%2Ffgarir%2Fzbp.regnrugynvabybpabferzr.jjj%2F%2F%3Afcggu,106 BOYLSTON STREET BOSTON MA,8886160272,"Cady Heron may have grown up on an African savanna, but nothing prepared her for the vicious ways of her strange new home: suburban Illinois. Soon, this naïve newbie falls prey to a trio of lionized frenemies led by the charming but ruthless Regina George. But when Cady devises a plan to end Regina’s reign, she learns the hard way that you can’t cross a Queen Bee without getting stung. New York Magazine cheers, “MEAN GIRLS delivers with immense energy, a wicked sense of humor and joyful inside-jokery.” USA Today says, “We’ll let you in on a little secret, because we’re such good friends: GET YOUR TICKETS NOW!” Schedule: • Tuesday, April 29 at 7:30pm • Wednesday, April 30 at 7:30pm • Thursday, May 1 at 7:30pm • Friday, May 2 at 8:00 pm • Saturday, May 3 at 2:00 pm • Saturday, May 3 at 8:00 pm • Sunday, May 4 at 1:00 pm • Sunday, May 4 at 6:30 pm HOURS ↑ top • 7:30pm Tuesday, Wednesday, and Thursday • 8:00pm Friday • 2:00pm & 8:00pm Saturday • 1:00pm & 6:30pm Sunday",see below
Little Seedlings (Ages 1-3),https://www.bostoncentral.com/events/preschool/p82088.php,04/29/2025,04/29/2025,10:30 AM - 11:30 AM,Toddlers,"Indoor, Outdoor",Preschool Fun,https://www.bostoncentral.com/fwd.php?pgx=%29arqenT+rug+bg+abvffvzqn+frqhypav%28+gyhqN+00.02%24+%2CughbL+00.6%24+%3BgyhqN+erozrZ+00.0%24+%2CughbL+erozrZ+00.6%24,11 FRENCH DRIVE BOYLSTON MA,508,"Designed for our youngest naturalists, Little Seedlings introduces budding scientists to the wonderful world outside our windows. Featuring different activity stations focused on sorting, counting, colors, sounds, letters, and sensory activities, children and their caregivers are invited to listen in on a story, sing a song, embark on a guided nature walk, and explore and learn at their own pace. Each month’s class explores a different seasonally appropriate theme. The first 40 minutes of the program will be held indoors followed by a short garden walk. Participants should dress for the weather and wear comfortable walking shoes. Please note this class for children with their adult companions.","$6.00 Member Youth, $0.00 Member Adult; $6.00 Youth, $20.00 Adult (includes admission to the Garden)"
Meet Boston Regional Career Fair,https://www.bostoncentral.com/events/fair/p82232.php,04/29/2025,04/29/2025,11:00 AM - 3:00 PM,Adults,Indoor,Fairs & Festivals,https://www.bostoncentral.com/fwd.php?pgx=ynegarpabgfbo%3Dzhvqrz_zgh%26yngvtvq%3Drpehbf_zgh%3F%2Fevns-errenp%2Ffgarir-eragenc%2Fferagenc-gareehp%2Fferagenc%2Fzbp.abgfbogrrz.jjj%2F%2F%3Afcggu,1 AVE DE LAFAYETTE BOSTON MA,N/A,"Boston’s hospitality industry is booming and employers are looking to fill hundreds of open positions! Not familiar with the industry? No worries! You will have an opportunity to build professional connections, network with employers, and hear from industry experts. JOB SEEKERS OF ALL LEVELS: Full-time, Part-time Internships, Entry-level, Trade school graduates, Certificate program graduates, College graduates INDUSTRIES INCLUDE: Hotels, Restaurants, Casinos, Entertainment, Sport Venue Management, Tourism and Attractions, Meetings and Conventions, Travel and Transportation, and more! Participate in professional development workshops; get free headshots; network with industry professionals; schedule on-site job interviews and more! Register at MeetBoston.com/Career-Fair WEBSITE ↑ top www.meetboston.com/partners/current-partners/partner-events/career-fair/?utm_source=digital&utm_medium=bostoncentral LOCATION ↑ top 1 Ave de Lafayette, Boston, MA, 02111 map RELATED LINKS ↑ top Profiles Fairs & Festivals Localities Boston Events Meet Boston Regional Career Fair , 4/29/25-4/29/25 Info changes frequently. We cannot warrant it.  Verify with Meet Boston Regional Career Fair before making the trek. If you find an error, please report it... Report Error Popular Resources Boston with Kids Free Things to Do Family & Kids Events Mass RMV - DMV Boston Birthday Parties Boston Museums Rose Kennedy Greenway Boston Aquarium Boston Massachusetts Boston Bowling Boston Haymarket Boston Whale Watching",Free
Roots Roadshow,https://www.bostoncentral.com/events/music/p82297.php,04/29/2025,04/29/2025,7:00 pm,"Kids, Teens, Adults",Indoor,Music & Concerts,https://www.bostoncentral.com/fwd.php?pgx=5202-jbufqnbe-fgbbe%2Ffgarir%2F939-rsnp-zbbe-qre%2Fhqr.rryxero.jjj%2F%2F%3Afcggu,939 BOYLSTON ST BOSTON MA,617,"The Roots Roadshow series, presented by Berklee's American Roots Music Program, explores and celebrates America’s rich musical heritage. Each month, the series presents a variety of student bands and ensembles performing styles such as country blues, old-time, bluegrass, new acoustic, Celtic, classic country, and Western swing. Whether it is a faculty-led ensemble, a new student project, or a band making its name in the Boston scene, you never know what will happen at a Roots Roadshow.",Free
Shinrin-Yoku (Forest Bathing) in the Conservatory,https://www.bostoncentral.com/events/health/p82116.php,04/30/2025,04/30/2025,6:00 PM - 7:30 PM,Adults,Indoor,Health & Wellness,https://www.bostoncentral.com/fwd.php?pgx=kcfn.enqarynps2%25344n3%25teb.tora.rfnupehcs2%25s2%25n3%25fcggu%3Dynp%2606641%3Dqvc%3Fkcfn.abvgnphqRabegnC%2Fteb.tora.rfnupehc%2F%2F%3Afcggu,11 FRENCH DRIVE BOYLSTON MA,508,"What to expect: A guided experience in the Orangerie where you will walk around the conservatory and stop and sit together. We will focus on our senses to develop an immediate connection with the plants. This is a very relaxed, slow, and mindful way of walking. The walk should last about 1.5 hours and we will finish with a Shinrin Yoku tea and a small snack. The conservatories are warm so you can dress in comfortable clothing.",$40 Member Adult; $48 Adult (includes admission to the Gardens)
Wenham Wednesdays – Games,https://www.bostoncentral.com/events/exhibit/p82209.php,04/30/2025,04/30/2025,1:15 pm to 4:00 pm,Kids,Indoor,Exhibits,https://www.bostoncentral.com/fwd.php?pgx=fgrxpvg%2Fg%2F696001%2Ffgarir%2Fzbp.ngfrigarir%2F%2F%3Afcggu,132 MAIN STREET WENHAM MA,9784682377,"Early release drop-off program for Hamilton-Wenham elementary students. Sign up for one Wednesday, or every Wednesday! Board Game Club Enjoy an afternoon at the museum with friends. Bring a snack Choose from a variety of board games to play with others. Selection includes: Battleship, Sorry, Twister, Throw Throw Burrito, Checkers, Candyland, Connect 4, Guess Who, and more Have a favorite game that you think we should add? Just let us know! Explore the museum galleries until it is time to go home Every Wednesday during the school year, Wenham Wednesdays will feature activities such as craft projects, board games, LEGO building, paper crafts, and more – plus time for students to explore the museum galleries with friends. Learn more: www.wenhammuseum.org/wenham-wednesdays",$35.00
Volunteer Expo at Prudential Center,https://www.bostoncentral.com/events/volunteer/p82221.php,04/30/2025,04/30/2025,4:30 pm - 6:30 pm,"Kids, Teens, Adults",Indoor,Volunteer,https://www.bostoncentral.com/fwd.php?pgx=%2F52-bckr-errgahybi%2Ffgarir%2Ffrparverckr%2Fzbp.ergarpynvgarqhec.jjj%2F%2F%3Afcggu,800 BOYLSTON ST BOSTON MA,N/A,"The 18th Annual Volunteer Expo seeks to assist local nonprofit organizations in their search for volunteers. The event brings together locals, students and workers from the community and allows attendees to interact with representatives from nonprofit organizations looking for volunteers. This event is free and open to the public - come check it out! WEBSITE ↑ top www.prudentialcenter.com/experiences/events/volunteer-expo-25/ LOCATION ↑ top 800 Boylston St, Boston, MA, 02199 map RELATED LINKS ↑ top Profiles Volunteer Localities Boston Events Volunteer Expo at Prudential Center , 4/30/25-4/30/25 Info changes frequently. We cannot warrant it.  Verify with Volunteer Expo at Prudential Center before making the trek. If you find an error, please report it... Report Error Popular Resources Boston with Kids Free Things to Do Family & Kids Events Mass RMV - DMV Boston Birthday Parties Boston Museums Rose Kennedy Greenway Boston Aquarium Boston Massachusetts Boston Bowling Boston Haymarket Boston Whale Watching",Free
Harvard Arts Festival 2025,https://www.bostoncentral.com/events/fair/p82143.php,05/01/2025,05/04/2025,Varies,"Toddlers, Kids, Teens, Adults","Indoor, Outdoor",Fairs & Festivals,https://www.bostoncentral.com/fwd.php?pgx=fgen%2Fhqr.qenienu.fns.nsb%2F%2F%3Afcggu,"HARVARD UNIVERSITY, CAMBRIDGE MA",N/A,"The Harvard ARTS FIRST Festival is now Harvard Arts Festival, otherwise known as Arts Fest. The Office for the Arts is excited to continue producing this annual campus-wide event to highlight and celebrate all forms of artmaking. Each Harvard Arts Festival is a unique annual celebration of the university community's artistic creativity. We invite you to join us May 1-4, 2025! We look forward to welcoming you as we showcase the creativity of the Harvard arts community through performances, art exhibitions and art-making activities. All the arts. All are welcome.",see below
Utopian Hotline,https://www.bostoncentral.com/events/theater/p78713.php,05/01/2025,05/18/2025,Not Available,"Kids, Teens, Adults",Indoor,Theater & Shows,https://www.bostoncentral.com/fwd.php?pgx=%2Fravygbu-anvcbgh%2Ffgarir%2Fteb.abferzrfgen%2F%2F%3Afcggu,1 MUSEUM OF SCIENCE DRIVEWAY BOSTON MA,N/A,"'Step into the cosmic conversation with Theater Mitu’s latest creation. Inspired by the 1977 NASA Voyager mission, which launched a vinyl recording of natural sounds found on Earth into space, as well as the uncertainty and isolations surrounding the Covid-19 pandemic, this experimental performance begs the question: if we were to send another message into the distant future, what message would we send? Part vinyl recording and part live performance, Utopian Hotline uses real voicemails left on a public hotline and to create a moment of community, while inviting audience members around a communal table to re-imagine our shared future. This collaborative performance, done in partnership with SETI Institute, Arizona State University’s Interplanetary Initiative, and Brooklyn Independent Middle School, is a call for audiences to join together and leave an offering of hope for mankind’s future.'",see below
The Divine Feminine: A Journey of Transformation,https://www.bostoncentral.com/events/artsculture/p82344.php,05/01/2025,05/01/2025,6:00 pm - 8:00 pm,"Kids, Teens, Adults",Indoor,Arts & Culture,https://www.bostoncentral.com/fwd.php?pgx=%2Fabvgnzebsfaneg-sb-lraehbw-n-ravavzrs-ravivq-rug%2Fteb.ergarpfgenynehgyhpvgyhz%2F%2F%3Afcggu,41 SECOND STREET CAMBRIDGE MA,6175771400,"Join us for an exciting art opening! Through a rich tapestry of hand-crafted prints, fabric, oil paint, acrylic paint, acrylic ink, recycled materials, and gold leaf, Williams brings to life the stages of transformation she has experienced. Each piece reflects both her personal evolution and the sacred presence of those who have guided her—goddesses and ancestors who whisper through the textures, layers, and luminous details of her work. From a time when she was unable to fully embrace her identity as an artist to the moment of breaking free and stepping into her power, this exhibition captures the essence of becoming. It is not the end of a journey, but a testament to the sacred process of reclaiming one’s purpose. Through vibrant imagery and ancestral connection, Williams honors the divine feminine as both a source of strength and a guiding light, reminding us all of the beauty in transformation. WEBSITE ↑ top multiculturalartscenter.org/the-divine-feminine-a-journey-of-transformation/ LOCATION ↑ top 41 Second Street, Cambridge, MA, 02141 map Phone: 6175771400 The Multicultural Arts Center is located just a few blocks from the Green line Lechmere MBTA Station. The East Cambridge Parking Garage is entered off Spring Street, between First & Second Streets, one block away from us, and open 24/7. RELATED LINKS ↑ top Profiles Arts & Culture Localities Cambridge Events The Divine Feminine: A Journey of Transformation... , 5/1/25-5/1/25 Info changes frequently. We cannot warrant it.  Verify with The Divine Feminine: A Journey of Transformation before making the trek. If you find an error, please report it... Report Error Popular Resources Boston with Kids Free Things to Do Family & Kids Events Mass RMV - DMV Boston Birthday Parties Boston Museums Rose Kennedy Greenway Boston Aquarium Boston Massachusetts Boston Bowling Boston Haymarket Boston Whale Watching",Free
Harvard Arts Festival,https://www.bostoncentral.com/events/fair/p82402.php,05/01/2025,05/04/2025,All day,"Kids, Teens, Adults","Indoor, Outdoor",Fairs & Festivals,https://www.bostoncentral.com/fwd.php?pgx=17470523444194-27159423444194-fong%23ynivgfrsfgenqenienu%2Fhqr.qenienu.rtryybp.enqarynp%2F%2F%3Afcggu,2 OXFORD STREET CAMBIRDGE MA,617,"Welcome to Arts Fest (formerly ARTS FIRST), Harvard University’s Arts Festival! Produced by the Office for the Arts at Harvard, this annual campus-wide event takes place May 1-4 and showcases the expansive creativity and innovation of Harvard students, staff, alums and faculty. Enjoy the dynamic imagination and cultural expression at the heart of this festival by visiting many of the university’s iconic indoor and outdoor spaces transformed by artmaking and open for all to explore. Year after year, Arts Fest draws 5,000+ audience members who are entertained, delighted and inspired by the many art forms on display on outdoor and indoor stages, in Harvard’s museums, galleries and classrooms, and in the green spaces of Harvard Yard. Can’t get to campus? Watch selected events livestreamed at HarvardArts on YouTube. Highlights include an Afro-Cuban jazz concert led by Yosvany Terry, a performance and conversation with 2025 Harvard Arts Medalist and operatic bass-baritone Davòne Tines ‘09, an interdisciplinary a concert of pop music hits arranged for jazz orchestra, a Performance Fair of short interdisciplinary performances taking place simultaneously on 11 stages throughout the day, family-friendly artmaking activities, and much more. The festival is open to all, family-friendly and mostly free. (Some ticketed events charge for admission.) The Office for the Arts invites everyone to join us!",Free
Castle of Our Skin | Alchemy,https://www.bostoncentral.com/events/music/p81247.php,05/02/2025,05/02/2025,7:00 pm - 9:00 pm,"Infants, Toddlers, Kids, Teens, Adults",Indoor,Music & Concerts,https://www.bostoncentral.com/fwd.php?pgx=%2Flzrupyn-favxf-ehb-sb-rygfnp%2Fgarir%2Fhqr.ltaby%2F%2F%3Afcggu,27 GARDEN STREET CAMBRIDGE MA,N/A,"Castle of our Skins’ Portrait Concert Alchemy: featuring composer Jonathan Bailey Holland Ensemble-in-Residence Castle of Our Skins returns to the Longy School of Music of Bard College for an immersive three-day residency focused around the music of Jonathan Bailey Holland. Their sixth residency, COOS teams up with Bailey Holland to work with students in master classes, classroom visits, and affinity spaces, and present a capstone portrait concert featuring chamber music from the composer. Post-concert reception to follow.",Free
Community Stargazing - Moon Party,https://www.bostoncentral.com/events/science/p81329.php,05/02/2025,05/02/2025,Stop by anytime between 8:00 pm to 9:00 pm,"Toddlers, Kids, Teens, Adults",Outdoor,Science & Technology,https://www.bostoncentral.com/fwd.php?pgx=tavmntengf2lnz%2Fgarir%2Fteb.ergarp-zp%2F%2F%3Afcggu,100 STATE STREET WALTHAM MA,508,"Participants of all ages are welcome! Use telescopes to observe the Moon! McAuliffe Center staff are available to answer your questions about telescopes and our Universe. Important Information: This event is weather-dependent. In case of inclement weather or conditions inconducive for observing, this event will be cancelled. Please dress according to the weather. WEBSITE ↑ top cm-center.org/event/may2stargazing LOCATION ↑ top 100 State Street, Waltham, MA, 01701 map Phone: 508-626-4050 May Hall Lawn at Framingham State University RELATED LINKS ↑ top Profiles Science & Technology Localities Framingham Events Community Stargazing - Moon Party , 5/2/25-5/2/25 Info changes frequently. We cannot warrant it.  Verify with Community Stargazing - Moon Party before making the trek. If you find an error, please report it... Report Error Popular Resources Boston with Kids Free Things to Do Family & Kids Events Mass RMV - DMV Boston Birthday Parties Boston Museums Rose Kennedy Greenway Boston Aquarium Boston Massachusetts Boston Bowling Boston Haymarket Boston Whale Watching",Free
Boston Panda Fest at City Hall Plaza,https://www.bostoncentral.com/events/fair/p81452.php,05/02/2025,05/04/2025,4:00pm - 10:00pm,"Kids, Teens, Adults",Outdoor,Fairs & Festivals,https://www.bostoncentral.com/fwd.php?pgx=%2Fzbp.fgfrsnqanc.jjj%2F%2F%3Afcggu,CITY HALL PLAZA BOSTON MA,000,"Panda fest is one of the biggest outdoor Asian food festivals in the US with experiential activities, tastings, and market fairs that showcases the vibrant food, art and cultural traditions from Asia. Don’t miss the show-stopping 15-foot inflatable panda, and enjoy panda-themed delights from vendors, featuring everything from panda-shaped treats to charming panda-inspired packaging. Enjoy a lineup of captivating live performances, featuring traditional music, contemporary Asian pop, vibrant dance routines, and theatrical acts. Highlights include lion dance shows, K-pop and thai dance. Shop an array of unique merchandise inspired by Asian culture, including handmade crafts, clothing, accessories, and specialty ingredients. The market fair offers a chance to take home a piece of Asia, whether it’s traditional calligraphy art, artisanal teas, or contemporary designs with cultural flair. What else can I Expect? - 2 FREE GIFTS: one customized Panda pin with Boston feature, one headband (worth $11) - 60+ Asian food vendors - 200 + Asian street food - 15 + Merchandise vendors - Asian culture performance - Panda related merchandise - Panda inflatable Prepare to indulge in a culinary journey across Asia with an extensive lineup of food stalls and trucks serving iconic dishes and hidden gems from countries like China, Japan, Korea, Thailand, Vietnam, and more. From steaming dumplings and sushi rolls to spicy street food and decadent desserts, every bite is a celebration of Asia's diverse and delectable cuisine. FInd more exciting Boston Festivals to enjoy and explore in our handy guide to family fun!",$see below
Miranda Russell,https://www.bostoncentral.com/events/music/p81499.php,05/02/2025,05/02/2025,8:00 pm to 10:00 pm,"Kids, Teens, Adults",Indoor,Music & Concerts,https://www.bostoncentral.com/fwd.php?pgx=fgrxpvg%2Fg%2F62569%2Ffgarir%2Fzbp.ngfrigarir%2F%2F%3Afcggu,13 WALLIS ST BEVERLY MA,978,"North Shore audiences pack the house for Miranda Russell and her extraordinary 6 piece band. A powerful and moving vocalist, Miranda's performance centers on nuanced treatments of an eclectic range of favorites from Cole Porter to Richard Thompson. Critics have routinely praised her dynamic interpretation and delivery of the American Songbook as well as her mastery of contemporary songwriters like Paul Simon and Gillian Welch.",$39.00
Pub Trivia Night at St. Mary's,https://www.bostoncentral.com/events/fundraiser/p82039.php,05/02/2025,05/02/2025,5:30pm - 9:30pm,Adults,Indoor,Fundraisers,https://www.bostoncentral.com/fwd.php?pgx=iq2jjmy3%2Fnz.hy%2F%2F%3Afcggu,67 HARVARD STREET BROOKLINE MA,N/A,"St. Mary's annual fundraiser is here! Get ready for an evening filled with trivia, music, and unforgettable memories—all in support of the beloved St. Mary of the Assumption School! 5:30pm Parish Hall Doors Open Cocktail Hour and Silent Auction Begins 6:30pm Dinner and Dancing Trivia Begins (not just 80s themed!) Attire: Rock your best 80s style! St.Mary’s Parish Hall 67 Harvard St, Brookline, MA 02445 Kindly RSVP by Friday, April 18th, 2025 using the following link - https://lu.ma/3lzww2dv Thank you to our auction donors throughout Boston!",$50
William Drummond Fife and Drum Corps Tattoo and Lexington Muster,https://www.bostoncentral.com/events/music/p82226.php,05/02/2025,05/03/2025,Hours Varysee below,"Infants, Toddlers, Kids, Teens, Adults",Outdoor,Music & Concerts,https://www.bostoncentral.com/fwd.php?pgx=%2Fteb.fewqabznvqznvyyvj.jjj%2F%2F%3Afcggu,MASSACHUSETTS AVE. LEXINGTON MA,N/A,"Tattoo: Friday, May 2, 6:30-8:30 pm on the Lexington Battle Green (1625 Massachusetts Ave.). Free outdoor evening performance of fife and drum music at the scene of the first skirmish in the Revolutionary War. Hosted by the William Diamond Junior Fife & Drum Corps of Lexington and featuring four other corps. Lexington Muster: Saturday, May 3, 12:00-4:00 pm at Hastings Park in Lexington (corner of Massachusetts Ave. and Worthen Rd.). Free outdoor afternoon of music, history and entertainment by two dozen fife and drum corps representing different eras including the Revolution, hosted by the William Diamond Junior Fife & Drum Corps of Lexington. Begins with a 250th anniversary ceremony on the Lexington Battle Green (1624 Massachusetts Ave.) honoring the 7 Lexington patriots who fell on the Green at the Battle of Lexington in 1775. Free parking; walking distance from Lexington’s historic Battle Green, Visitors Center and historic houses. HOURS ↑ top • May 2: 6:30-8:30 pm • May 3rd: 12:00-4:00 pm WEBSITE ↑ top www.williamdiamondjrs.org/ LOCATION ↑ top Massachusetts Ave., Lexington, MA, 02421 map Tattoo (May 2nd) Lexington Battle Green (1625 Massachusetts Ave.) Muster (May 3rd) Hastings Park in Lexington (corner of Massachusetts Ave. and Worthen Rd.) RELATED LINKS ↑ top Profiles Music & Concerts Localities Lexington Events William Drummond Fife and Drum Corps Tattoo and Le... , 5/2/25-5/3/25 Info changes frequently. We cannot warrant it.  Verify with William Drummond Fife and Drum Corps Tattoo and Lexington Muster before making the trek. If you find an error, please report it... Report Error Popular Resources Boston with Kids Free Things to Do Family & Kids Events Mass RMV - DMV Boston Birthday Parties Boston Museums Rose Kennedy Greenway Boston Aquarium Boston Massachusetts Boston Bowling Boston Haymarket Boston Whale Watching",Free
